<?xml version="1.0" encoding="UTF-8"?>
<!DOCTYPE assessment_current_treatment SYSTEM "assessment_current_treatment.dtd">
<assessment_current_treatment>
<id>330e8400-e29b-41d4-a716-44665544000d</id>
<assessment_id>660e8400-e29b-41d4-a716-446655440001</assessment_id>
<has_physiotherapy>yes</has_physiotherapy>
<physiotherapy_details>Example text.</physiotherapy_details>
<has_occupational_therapy>yes</has_occupational_therapy>
<occupational_therapy_details>Example text.</occupational_therapy_details>
<has_injection_therapy>yes</has_injection_therapy>
<injection_details>Example text.</injection_details>
<has_splinting_bracing>yes</has_splinting_bracing>
<splinting_bracing_details>Example text.</splinting_bracing_details>
<current_medications>Paracetamol</current_medications>
<has_alternative_therapy>yes</has_alternative_therapy>
<alternative_therapy_details>Example text.</alternative_therapy_details>
<treatment_effectiveness>effective</treatment_effectiveness>
<current_treatment_notes>Example text.</current_treatment_notes>
<created_at>2026-04-09T10:00:00Z</created_at>
<updated_at>2026-04-09T10:00:00Z</updated_at>
</assessment_current_treatment>
